A1: 品名 | B1: 款号 | C1: 名称 | D1: 价格 | E1: 日期 | F1: 入库 | G1: 销售 | H1: 库存 | I1: 产销比 | J1: 折扣 | K1: 折后价 | L1: 原总价 | M1: 折后总价
A2: 短袖Ｔ恤 | B2: 5300 | C2: 100%棉/增白/浅宝蓝/圆领/短袖T恤 | D2: 325 | E2: 2010-4-12 15:44:45 | F2: 503 | G2: 298 | H2: 205 | I2: =G2/F2 -> 0.59244532803180916 | J2: 3 | K2: =D2*J2/10 -> 97.5 | L2: =D2*H2 -> 66625 | M2: =L2*J2/10 -> 19987.5 | N2: 1、库存50件以下的，3折（黄色）
A3: 短袖Ｔ恤 | B3: 5243 | C3: 草绿/深灰色/6cm翻领/2.5cm窄门襟/100%棉/下摆罗纹收口/6cm修身/短袖商务T恤 | D3: 160 | E3: 2009-3-10 10:07:28 | F3: 2679 | G3: 2478 | H3: 195 | I3: =G3/F3 -> 0.92497200447928329 | J3: 3 | K3: =D3*J3/10 -> 48 | L3: =D3*H3 -> 31200 | M3: =L3*J3/10 -> 9360 | N3: 2、入库时间09年前的，3折（burrey除外）
A4: 短袖Ｔ恤 | B4: 5262 | C4: 100%棉/橄榄绿/短袖T恤 | D4: 188 | E4: 2010-5-15 17:55:56 | F4: 1603 | G4: 1486 | H4: 103 | I4: =G4/F4 -> 0.92701185277604492 | J4: 3 | K4: =D4*J4/10 -> 56.4 | L4: =D4*H4 -> 19364 | M4: =L4*J4/10 -> 5809.2 | N4: 3、burrey系列，4折
A5: 短袖Ｔ恤 | B5: 5259 | C5: 80支双股高支纱/100%棉/收腰6cm/双珠地/粉绿色/门襟拼条罗纹收口/短袖T恤 | D5: 108 | E5: 2009-7-10 11:02:18 | F5: 298 | G5: 215 | H5: 78 | I5: =G5/F5 -> 0.72147651006711411 | J5: 3 | K5: =D5*J5/10 -> 32.4 | L5: =D5*H5 -> 8424 | M5: =L5*J5/10 -> 2527.2 | N5: 4、韩国首尔系列，4折
A6: 短袖Ｔ恤 | B6: 5275 | C6: POLO领/米色/水粉/卡其/橙色/宽间条/短袖T恤 | D6: 165 | E6: 2009-6-16 16:07:25 | F6: 832 | G6: 772 | H6: 47 | I6: =G6/F6 -> 0.92788461538461542 | J6: 3 | K6: =D6*J6/10 -> 49.5 | L6: =D6*H6 -> 7755 | M6: =L6*J6/10 -> 2326.5 | N6: 5、库存>1500的，5折
A7: 短袖Ｔ恤 | B7: 5266 | C7: 丝棉/深花蓝/扎空/POLO领/短袖T恤 | D7: 325 | E7: 2010-4-13 17:44:48 | F7: 465 | G7: 417 | H7: 44 | I7: =G7/F7 -> 0.89677419354838706 | J7: 3 | K7: =D7*J7/10 -> 97.5 | L7: =D7*H7 -> 14300 | M7: =L7*J7/10 -> 4290 | N7: 6、>1500库存>1000的，6折
A8: 短袖Ｔ恤 | B8: 5462 | C8: 莱卡棉/英国Burberry条纹/灰蓝色/白色领子/横条纹/儿童款/短袖T恤 | D8: 129 | E8: 2010-5-24 18:04:04 | F8: 115 | G8: 70 | H8: 43 | I8: =G8/F8 -> 0.60869565217391308 | J8: 3 | K8: =D8*J8/10 -> 38.7 | L8: =D8*H8 -> 5547 | M8: =L8*J8/10 -> 1664.1 | N8: 7、产销比<50%的，且库存300以下的，5折（入库需在5月1日前）
A9: 短袖Ｔ恤 | B9: 5459 | C9: 莱卡棉/英国博柏丽Burberry条纹/粉紫/白色条纹/横条纹/儿童款/短袖T恤 | D9: 129 | E9: 2010-5-24 18:04:04 | F9: 140 | G9: 101 | H9: 37 | I9: =G9/F9 -> 0.72142857142857142 | J9: 3 | K9: =D9*J9/10 -> 38.7 | L9: =D9*H9 -> 4773 | M9: =L9*J9/10 -> 1431.9 | N9: 8、产销比>70%的，且库存500-1000的，7折
A10: 短袖Ｔ恤 | B10: 5309 | C10: 100%棉/紫色/千鸟格领/短袖T恤 | D10: 265 | E10: 2010-7-26 17:44:45 | F10: 190 | G10: 151 | H10: 36 | I10: =G10/F10 -> 0.79473684210526319 | J10: 3 | K10: =D10*J10/10 -> 79.5 | L10: =D10*H10 -> 9540 | M10: =L10*J10/10 -> 2862 | N10: 9、7月1日后入库的，且库存>200的，7折
A11: 短袖Ｔ恤 | B11: 5421 | C11: 宽窄黑条纹/四粒扣窄门襟/针织领带/美国平纹T恤 | D11: 95 | E11: 2009-5-11 17:56:42 | F11: 924 | G11: 887 | H11: 29 | I11: =G11/F11 -> 0.95995670995671001 | J11: 3 | K11: =D11*J11/10 -> 28.5 | L11: =D11*H11 -> 2755 | M11: =L11*J11/10 -> 826.5 | N11: 10、其余6折扣
A12: 短袖Ｔ恤 | B12: 5457 | C12: 莱卡棉/英国Burberry条纹/橄榄绿/白色领子/横条纹/儿童款/短袖T恤 | D12: 129 | E12: 2010-5-24 18:04:04 | F12: 91 | G12: 59 | H12: 29 | I12: =G12/F12 -> 0.64835164835164838 | J12: 3 | K12: =D12*J12/10 -> 38.7 | L12: =D12*H12 -> 3741 | M12: =L12*J12/10 -> 1122.3
A13: 短袖Ｔ恤 | B13: 5422 | C13: 100%棉/水洗蓝/红色横条/短袖T恤 | D13: 188 | E13: 2010-5-15 17:55:56 | F13: 1262 | G13: 1226 | H13: 27 | I13: =G13/F13 -> 0.97147385103011097 | J13: 3 | K13: =D13*J13/10 -> 56.4 | L13: =D13*H13 -> 5076 | M13: =L13*J13/10 -> 1522.8 | N13: 8月27日23点59分4折及以下商品下线，9月1日0点上线。
A14: 短袖Ｔ恤 | B14: 5423 | C14: 100%棉/深灰色/千鸟格领/短袖T恤 | D14: 265 | E14: 2010-7-26 17:44:45 | F14: 210 | G14: 181 | H14: 25 | I14: =G14/F14 -> 0.86190476190476195 | J14: 3 | K14: =D14*J14/10 -> 79.5 | L14: =D14*H14 -> 6625 | M14: =L14*J14/10 -> 1987.5 | N14: 特价区内包含的夏日商品同时下线并转移出特价区进夏日商品专区。
A15: 短袖Ｔ恤 | B15: 5424 | C15: 双领/6cm布面翻领/3cm立领/深灰多彩条文/100%棉/6cm修身/短袖商务T恤 | D15: 178 | E15: 2009-4-16 9:00:47 | F15: 1998 | G15: 1953 | H15: 24 | I15: =G15/F15 -> 0.97747747747747749 | J15: 3 | K15: =D15*J15/10 -> 53.4 | L15: =D15*H15 -> 4272 | M15: =L15*J15/10 -> 1281.6 | N15: 特价区4折抢购活动27日23点59分同时下线
A16: 短袖Ｔ恤 | B16: 5460 | C16: 100%棉/深蓝/海蓝/天蓝色/横条纹/POLO领/短袖T恤 | D16: 148 | E16: 2009-7-8 11:35:26 | F16: 833 | G16: 810 | H16: 20 | I16: =G16/F16 -> 0.97238895558223293 | J16: 3 | K16: =D16*J16/10 -> 44.4 | L16: =D16*H16 -> 2960 | M16: =L16*J16/10 -> 888 | N16: 夏季商品抢购不可使用优惠券。可下在同一定单中，做区分。
A17: 短袖Ｔ恤 | B17: 5456 | C17: 双领/6cm布面翻领/3cm立领/3cm、3粒扣门襟/彩条/100%棉/修身短袖T恤 | D17: 178 | E17: 2009-4-16 9:00:47 | F17: 2200 | G17: 2185 | H17: 5 | I17: =G17/F17 -> 0.99318181818181817 | J17: 3 | K17: =D17*J17/10 -> 53.4 | L17: =D17*H17 -> 890 | M17: =L17*J17/10 -> 267
A18: 短袖Ｔ恤 | B18: 5430 | C18: 100%棉/玫粉色/珠地/短袖T恤 | D18: 228 | E18: 2010-5-31 17:43:08 | F18: 196 | G18: 184 | H18: 3 | I18: =G18/F18 -> 0.93877551020408168 | J18: 3 | K18: =D18*J18/10 -> 68.4 | L18: =D18*H18 -> 684 | M18: =L18*J18/10 -> 205.2
A19: 短袖Ｔ恤 | B19: 5419 | C19: 黑条/白色/花灰/横条/双层领/短袖T恤 | D19: 160 | E19: 2010-4-6 17:49:41 | F19: 598 | G19: 589 | H19: 2 | I19: =G19/F19 -> 0.98494983277591974 | J19: 3 | K19: =D19*J19/10 -> 48 | L19: =D19*H19 -> 320 | M19: =L19*J19/10 -> 96
A20: 短袖Ｔ恤 | B20: 5418 | C20: 55%绢丝45%棉/米色底黑色水波纹/字母印花/立领T恤 | D20: 365 | E20: 2010-7-29 14:36:52 | F20: 77 | G20: 73 | H20: 2 | I20: =G20/F20 -> 0.94805194805194803 | J20: 3 | K20: =D20*J20/10 -> 109.5 | L20: =D20*H20 -> 730 | M20: =L20*J20/10 -> 219
A21: 短袖Ｔ恤 | B21: 5429 | C21: 双领/6cm布面翻领/3cm立领/绿色多彩条文/双丝光棉/100%美国PIMA棉/6cm修身/短袖商务T恤 | D21: 208 | E21: 2008-6-5 15:03:16 | F21: 2147 | G21: 2139 | H21: 1 | I21: =G21/F21 -> 0.99627387051700045 | J21: 3 | K21: =D21*J21/10 -> 62.4 | L21: =D21*H21 -> 208 | M21: =L21*J21/10 -> 62.4
A22: 短袖Ｔ恤 | B22: 5303 | C22: 莱卡棉/英国博柏丽Burberry条纹/灰兰/白色领子/横条纹/短袖T恤 | D22: 268 | E22: 2009-6-25 14:51:37 | F22: 1119 | G22: 615 | H22: 494 | I22: =G22/F22 -> 0.54959785522788207 | J22: 4 | K22: =D22*J22/10 -> 107.2 | L22: =D22*H22 -> 132392 | M22: =L22*J22/10 -> 52956.800000000003
A23: 短袖Ｔ恤 | B23: 5271 | C23: 莱卡棉/英国博柏丽Burberry条纹/橄榄绿/白色领子/横条纹/短袖T恤 | D23: 268 | E23: 2009-6-25 15:06:37 | F23: 1073 | G23: 628 | H23: 434 | I23: =G23/F23 -> 0.5852749301025163 | J23: 4 | K23: =D23*J23/10 -> 107.2 | L23: =D23*H23 -> 116312 | M23: =L23*J23/10 -> 46524.800000000003
A24: 短袖Ｔ恤 | B24: 5315 | C24: 莱卡棉/英国博柏丽Burberry条纹/粉紫/白色领子/横条纹/短袖T恤 | D24: 268 | E24: 2009-6-25 15:05:22 | F24: 1117 | G24: 729 | H24: 379 | I24: =G24/F24 -> 0.65264100268576541 | J24: 4 | K24: =D24*J24/10 -> 107.2 | L24: =D24*H24 -> 101572 | M24: =L24*J24/10 -> 40628.800000000003
A25: 短袖Ｔ恤 | B25: 5278 | C25: 80支双股高支纱/100%棉/收腰6cm/双珠地/淡黄色/门襟拼条罗纹收口/短袖T恤 | D25: 108 | E25: 2009-7-13 17:22:56 | F25: 290 | G25: 159 | H25: 124 | I25: =G25/F25 -> 0.5482758620689655 | J25: 4 | K25: =D25*J25/10 -> 43.2 | L25: =D25*H25 -> 13392 | M25: =L25*J25/10 -> 5356.8
A26: 短袖Ｔ恤 | B26: 5216 | C26: 95%棉5%氨纶/字母烫钻印花/深蓝/圆领/短袖T恤 | D26: 228 | E26: 2010-7-27 11:40:40 | F26: 225 | G26: 122 | H26: 90 | I26: =G26/F26 -> 0.54222222222222227 | J26: 4 | K26: =D26*J26/10 -> 91.2 | L26: =D26*H26 -> 20520 | M26: =L26*J26/10 -> 8208
A27: 短袖Ｔ恤 | B27: 5268 | C27: 莱卡棉/英国博柏丽Burberry条纹/深紫/白色条纹/横条纹/儿童款/短袖T恤 | D27: 129 | E27: 2010-5-24 18:04:04 | F27: 195 | G27: 128 | H27: 64 | I27: =G27/F27 -> 0.65641025641025641 | J27: 4 | K27: =D27*J27/10 -> 51.6 | L27: =D27*H27 -> 8256 | M27: =L27*J27/10 -> 3302.4
A28: 短袖Ｔ恤 | B28: 5250 | C28: 莱卡棉/英国Burberry条纹/天蓝色/白色领子/横条纹/儿童款/短袖T恤 | D28: 129 | E28: 2010-5-24 18:04:04 | F28: 224 | G28: 160 | H28: 61 | I28: =G28/F28 -> 0.7142857142857143 | J28: 4 | K28: =D28*J28/10 -> 51.6 | L28: =D28*H28 -> 7869 | M28: =L28*J28/10 -> 3147.6
A29: 短袖Ｔ恤 | B29: 5270 | C29: 95%棉5%氨纶/深蓝/字母印花/圆领/短袖T恤 | D29: 228 | E29: 2010-7-12 18:06:41 | F29: 183 | G29: 109 | H29: 60 | I29: =G29/F29 -> 0.59562841530054644 | J29: 4 | K29: =D29*J29/10 -> 91.2 | L29: =D29*H29 -> 13680 | M29: =L29*J29/10 -> 5472
A30: 短袖Ｔ恤 | B30: 5222 | C30: 100支高支纱/100%棉/收腰6cm/双珠地/橙色/门襟拼条罗纹收口/短袖T恤 | D30: 120 | E30: 2009-7-13 17:28:08 | F30: 304 | G30: 253 | H30: 45 | I30: =G30/F30 -> 0.83223684210526316 | J30: 4 | K30: =D30*J30/10 -> 48 | L30: =D30*H30 -> 5400 | M30: =L30*J30/10 -> 2160
A31: 短袖Ｔ恤 | B31: 5458 | C31: 100%棉/80支双股高支纱/收腰6cm/双珠地/浅蓝/小尖领/绣花/短袖T恤 | D31: 168 | E31: 2009-7-16 18:21:24 | F31: 501 | G31: 458 | H31: 39 | I31: =G31/F31 -> 0.9141716566866267 | J31: 4 | K31: =D31*J31/10 -> 67.2 | L31: =D31*H31 -> 6552 | M31: =L31*J31/10 -> 2620.8
A32: 短袖Ｔ恤 | B32: 5465 | C32: 100%棉/80支双股高支纱/收腰6cm/双珠地/粉红色/门襟拼条罗纹收口/短袖T恤 | D32: 168 | E32: 2009-7-10 11:06:36 | F32: 296 | G32: 257 | H32: 39 | I32: =G32/F32 -> 0.8682432432432432 | J32: 4 | K32: =D32*J32/10 -> 67.2 | L32: =D32*H32 -> 6552 | M32: =L32*J32/10 -> 2620.8
A33: 短袖Ｔ恤 | B33: 5228 | C33: 100%棉/80支双股高支纱/收腰6cm/双珠地/浅黄/小尖领/绣花/短袖T恤 | D33: 168 | E33: 2009-7-16 18:22:30 | F33: 289 | G33: 242 | H33: 37 | I33: =G33/F33 -> 0.83737024221453282 | J33: 4 | K33: =D33*J33/10 -> 67.2 | L33: =D33*H33 -> 6216 | M33: =L33*J33/10 -> 2486.4
A34: 短袖Ｔ恤 | B34: 5236 | C34: 100%棉/100支高支纱/收腰6cm/双珠地/粉红/小尖领/绣花/短袖T恤 | D34: 168 | E34: 2009-7-16 18:18:19 | F34: 676 | G34: 640 | H34: 34 | I34: =G34/F34 -> 0.94674556213017746 | J34: 4 | K34: =D34*J34/10 -> 67.2 | L34: =D34*H34 -> 5712 | M34: =L34*J34/10 -> 2284.8
A35: 短袖Ｔ恤 | B35: 5414 | C35: 莱卡棉/英国博柏丽Burberry条纹/深紫/白色领子/横条纹/短袖T恤 | D35: 268 | E35: 2009-6-25 14:49:00 | F35: 1018 | G35: 993 | H35: 23 | I35: =G35/F35 -> 0.9754420432220039 | J35: 4 | K35: =D35*J35/10 -> 107.2 | L35: =D35*H35 -> 6164 | M35: =L35*J35/10 -> 2465.6
A36: 短袖Ｔ恤 | B36: 5292 | C36: 100%棉/80支双股高支纱/收腰6cm/双珠地/粉绿/白领/绣花/短袖T恤 | D36: 168 | E36: 2009-7-10 11:04:11 | F36: 488 | G36: 457 | H36: 20 | I36: =G36/F36 -> 0.93647540983606559 | J36: 4 | K36: =D36*J36/10 -> 67.2 | L36: =D36*H36 -> 3360 | M36: =L36*J36/10 -> 1344
A37: 短袖Ｔ恤 | B37: 5461 | C37: 100%棉/100支高支纱/收腰6cm/双珠地/孔雀蓝/小尖领/绣花/短袖T恤 | D37: 168 | E37: 2009-7-16 18:19:33 | F37: 546 | G37: 524 | H37: 20 | I37: =G37/F37 -> 0.95970695970695974 | J37: 4 | K37: =D37*J37/10 -> 67.2 | L37: =D37*H37 -> 3360 | M37: =L37*J37/10 -> 1344
A38: 短袖Ｔ恤 | B38: 2101 | C38: 100%棉/墨绿/草绿/横细条/短袖T恤 | D38: 295 | E38: 2010-5-1 14:17:27 | F38: 3712 | G38: 1546 | H38: 2154 | I38: =G38/F38 -> 0.41648706896551724 | J38: 5 | K38: =D38*J38/10 -> 147.5 | L38: =D38*H38 -> 635430 | M38: =L38*J38/10 -> 317715
A39: 短袖Ｔ恤 | B39: 5211 | C39: 100%棉/深宝蓝/翻领/短袖T恤 | D39: 265 | E39: 2010-4-23 11:54:25 | F39: 3025 | G39: 1194 | H39: 1825 | I39: =G39/F39 -> 0.39471074380165289 | J39: 5 | K39: =D39*J39/10 -> 132.5 | L39: =D39*H39 -> 483625 | M39: =L39*J39/10 -> 241812.5
A40: 短袖Ｔ恤 | B40: 5321 | C40: 100%棉/黑色/宝蓝/白/短袖T恤 | D40: 325 | E40: 2010-3-28 9:27:38 | F40: 3496 | G40: 1678 | H40: 1808 | I40: =G40/F40 -> 0.47997711670480547 | J40: 5 | K40: =D40*J40/10 -> 162.5 | L40: =D40*H40 -> 587600 | M40: =L40*J40/10 -> 293800
A41: 短袖Ｔ恤 | B41: 5463 | C41: 100%棉/鹅黄/黑色/横间条/短袖T恤 | D41: 265 | E41: 2010-4-30 12:57:36 | F41: 2544 | G41: 797 | H41: 1734 | I41: =G41/F41 -> 0.31328616352201261 | J41: 5 | K41: =D41*J41/10 -> 132.5 | L41: =D41*H41 -> 459510 | M41: =L41*J41/10 -> 229755
A42: 短袖Ｔ恤 | B42: 5043 | C42: 100%棉/白色/海蓝色/方格提花/短袖/T恤 | D42: 365 | E42: 2010-3-25 11:16:05 | F42: 2929 | G42: 1416 | H42: 1502 | I42: =G42/F42 -> 0.48344144759303515 | J42: 5 | K42: =D42*J42/10 -> 182.5 | L42: =D42*H42 -> 548230 | M42: =L42*J42/10 -> 274115
A43: 短袖Ｔ恤 | B43: 5072 | C43: 100%棉/海洋蓝/花灰/横间条/立翻领/短袖T恤 | D43: 265 | E43: 2010-3-12 17:29:06 | F43: 2427 | G43: 931 | H43: 1485 | I43: =G43/F43 -> 0.38360115368768027 | J43: 5 | K43: =D43*J43/10 -> 132.5 | L43: =D43*H43 -> 393525 | M43: =L43*J43/10 -> 196762.5
A44: 短袖Ｔ恤 | B44: 5069 | C44: 100%棉/上青/深银灰/白/短袖T恤 | D44: 325 | E44: 2010-3-28 9:27:38 | F44: 2782 | G44: 1280 | H44: 1483 | I44: =G44/F44 -> 0.46010064701653486 | J44: 5 | K44: =D44*J44/10 -> 162.5 | L44: =D44*H44 -> 481975 | M44: =L44*J44/10 -> 240987.5
A45: 短袖Ｔ恤 | B45: 7503 | C45: 100%棉/宝蓝/银灰/白/黑色/短袖T恤 | D45: 325 | E45: 2010-3-28 9:27:38 | F45: 2630 | G45: 1145 | H45: 1470 | I45: =G45/F45 -> 0.43536121673003803 | J45: 5 | K45: =D45*J45/10 -> 162.5 | L45: =D45*H45 -> 477750 | M45: =L45*J45/10 -> 238875
A46: 短袖Ｔ恤 | B46: 5045 | C46: 100%棉/海洋蓝/横细条纹/短袖T恤 | D46: 265 | E46: 2010-4-8 17:15:20 | F46: 1961 | G46: 670 | H46: 1285 | I46: =G46/F46 -> 0.34166241713411527 | J46: 5 | K46: =D46*J46/10 -> 132.5 | L46: =D46*H46 -> 340525 | M46: =L46*J46/10 -> 170262.5
A47: 短袖Ｔ恤 | B47: 7502 | C47: 100%棉/深蓝/彩蓝/横条/短袖T恤 | D47: 295 | E47: 2010-4-1 18:00:02 | F47: 2197 | G47: 916 | H47: 1271 | I47: =G47/F47 -> 0.41693218024578971 | J47: 5 | K47: =D47*J47/10 -> 147.5 | L47: =D47*H47 -> 374945 | M47: =L47*J47/10 -> 187472.5
A48: 短袖Ｔ恤 | B48: 5297 | C48: 100%棉/黑色/灰色/横细条/短袖T恤 | D48: 295 | E48: 2010-5-1 14:21:53 | F48: 1958 | G48: 763 | H48: 1187 | I48: =G48/F48 -> 0.38968335035750767 | J48: 5 | K48: =D48*J48/10 -> 147.5 | L48: =D48*H48 -> 350165 | M48: =L48*J48/10 -> 175082.5
A49: 短袖Ｔ恤 | B49: 7504 | C49: 100%棉/深紫/银灰/V领/短袖T恤 | D49: 325 | E49: 2010-4-12 15:44:45 | F49: 1892 | G49: 783 | H49: 1104 | I49: =G49/F49 -> 0.41384778012684992 | J49: 5 | K49: =D49*J49/10 -> 162.5 | L49: =D49*H49 -> 358800 | M49: =L49*J49/10 -> 179400
A50: 短袖Ｔ恤 | B50: 5417 | C50: 100%棉/森林绿/米白/间条/翻领/T恤 | D50: 265 | E50: 2010-3-30 17:57:59 | F50: 1889 | G50: 819 | H50: 1057 | I50: =G50/F50 -> 0.43356273160402331 | J50: 5 | K50: =D50*J50/10 -> 132.5 | L50: =D50*H50 -> 280105 | M50: =L50*J50/10 -> 140052.5
A51: 短袖Ｔ恤 | B51: 5089 | C51: 100%棉/草绿/水印花/翻领/短袖T恤 | D51: 295 | E51: 2010-3-31 15:40:13 | F51: 1876 | G51: 928 | H51: 944 | I51: =G51/F51 -> 0.49466950959488271 | J51: 5 | K51: =D51*J51/10 -> 147.5 | L51: =D51*H51 -> 278480 | M51: =L51*J51/10 -> 139240
A52: 短袖Ｔ恤 | B52: 5075 | C52: 100%棉/深紫/黑/灰花纱/双层领/短袖T恤 | D52: 295 | E52: 2010-3-30 17:57:59 | F52: 1557 | G52: 695 | H52: 852 | I52: =G52/F52 -> 0.44637122671804752 | J52: 5 | K52: =D52*J52/10 -> 147.5 | L52: =D52*H52 -> 251340 | M52: =L52*J52/10 -> 125670
A53: 短袖Ｔ恤 | B53: 5100 | C53: 100%棉/浅花灰/紫色/横条纹/短袖T恤 | D53: 265 | E53: 2010-4-14 18:03:50 | F53: 1406 | G53: 563 | H53: 832 | I53: =G53/F53 -> 0.40042674253200566 | J53: 5 | K53: =D53*J53/10 -> 132.5 | L53: =D53*H53 -> 220480 | M53: =L53*J53/10 -> 110240
A54: 短袖Ｔ恤 | B54: 5415 | C54: 100%棉/黑色/米白色/印花/衬衫款/短袖T恤 | D54: 325 | E54: 2010-4-29 13:14:50 | F54: 806 | G54: 358 | H54: 438 | I54: =G54/F54 -> 0.44416873449131511 | J54: 5 | K54: =D54*J54/10 -> 162.5 | L54: =D54*H54 -> 142350 | M54: =L54*J54/10 -> 71175
A55: 短袖Ｔ恤 | B55: 5261 | C55: 100%棉/玫紫/黑色/横间条/短袖T恤 | D55: 265 | E55: 2010-4-30 12:57:36 | F55: 691 | G55: 367 | H55: 316 | I55: =G55/F55 -> 0.53111432706222861 | J55: 5 | K55: =D55*J55/10 -> 132.5 | L55: =D55*H55 -> 83740 | M55: =L55*J55/10 -> 41870
A56: 短袖Ｔ恤 | B56: 5298 | C56: 70%莱赛尔纤维/10%桑蚕丝/黑色/白色/提花/短袖/T恤 | D56: 295 | E56: 2010-3-25 11:16:05 | F56: 520 | G56: 206 | H56: 311 | I56: =G56/F56 -> 0.39615384615384613 | J56: 5 | K56: =D56*J56/10 -> 147.5 | L56: =D56*H56 -> 91745 | M56: =L56*J56/10 -> 45872.5
A57: 短袖Ｔ恤 | B57: 5248 | C57: 95%棉5%氨纶/宝蓝色/烫钻/女式短袖T恤 | D57: 228 | E57: 2010-4-13 16:08:43 | F57: 463 | G57: 195 | H57: 265 | I57: =G57/F57 -> 0.42116630669546434 | J57: 5 | K57: =D57*J57/10 -> 114 | L57: =D57*H57 -> 60420 | M57: =L57*J57/10 -> 30210
A58: 短袖Ｔ恤 | B58: 5272 | C58: 100%棉/黑色/白色/净色/短袖T恤 | D58: 295 | E58: 2010-4-15 16:05:50 | F58: 714 | G58: 442 | H58: 263 | I58: =G58/F58 -> 0.61904761904761907 | J58: 5 | K58: =D58*J58/10 -> 147.5 | L58: =D58*H58 -> 77585 | M58: =L58*J58/10 -> 38792.5
A59: 短袖Ｔ恤 | B59: 5220 | C59: 100%棉/灰/兰/天兰/翻领/短袖T恤 | D59: 265 | E59: 2010-3-29 17:57:49 | F59: 642 | G59: 402 | H59: 229 | I59: =G59/F59 -> 0.62616822429906538 | J59: 5 | K59: =D59*J59/10 -> 132.5 | L59: =D59*H59 -> 60685 | M59: =L59*J59/10 -> 30342.5
A60: 短袖Ｔ恤 | B60: 5219 | C60: 100%棉/酱紫/翻领/多袋/短袖T恤 | D60: 265 | E60: 2010-5-4 16:09:57 | F60: 406 | G60: 178 | H60: 226 | I60: =G60/F60 -> 0.43842364532019706 | J60: 5 | K60: =D60*J60/10 -> 132.5 | L60: =D60*H60 -> 59890 | M60: =L60*J60/10 -> 29945
A61: 短袖Ｔ恤 | B61: 5312 | C61: 95%棉5%氨纶/黑色/灰色/印花/短袖T恤 | D61: 228 | E61: 2010-3-12 17:29:06 | F61: 568 | G61: 341 | H61: 224 | I61: =G61/F61 -> 0.60035211267605637 | J61: 5 | K61: =D61*J61/10 -> 114 | L61: =D61*H61 -> 51072 | M61: =L61*J61/10 -> 25536
A62: 短袖Ｔ恤 | B62: 5218 | C62: 100%棉/深灰/花灰/横条/短袖T恤 | D62: 265 | E62: 2010-4-1 18:00:02 | F62: 495 | G62: 294 | H62: 202 | I62: =G62/F62 -> 0.59393939393939399 | J62: 5 | K62: =D62*J62/10 -> 132.5 | L62: =D62*H62 -> 53530 | M62: =L62*J62/10 -> 26765
A63: 短袖Ｔ恤 | B63: 5273 | C63: 95%棉5%氨纶/黑色/立体印花/圆领/短袖T恤 | D63: 228 | E63: 2010-4-29 13:18:57 | F63: 549 | G63: 346 | H63: 199 | I63: =G63/F63 -> 0.63023679417122036 | J63: 5 | K63: =D63*J63/10 -> 114 | L63: =D63*H63 -> 45372 | M63: =L63*J63/10 -> 22686
A64: 短袖Ｔ恤 | B64: 5237 | C64: 100%棉/深紫色/浅紫/竖条/短袖T恤 | D64: 295 | E64: 2010-4-1 18:00:02 | F64: 390 | G64: 191 | H64: 196 | I64: =G64/F64 -> 0.48974358974358972 | J64: 5 | K64: =D64*J64/10 -> 147.5 | L64: =D64*H64 -> 57820 | M64: =L64*J64/10 -> 28910
A65: 短袖Ｔ恤 | B65: 5249 | C65: 100%棉/紫色/浅花紫/深蓝/横间条/短袖T恤 | D65: 265 | E65: 2010-4-15 17:10:48 | F65: 415 | G65: 219 | H65: 189 | I65: =G65/F65 -> 0.52771084337349394 | J65: 5 | K65: =D65*J65/10 -> 132.5 | L65: =D65*H65 -> 50085 | M65: =L65*J65/10 -> 25042.5
A66: 短袖Ｔ恤 | B66: 5313 | C66: 100%棉/深粉绿/紫红/横条/光影印/短袖T恤 | D66: 265 | E66: 2010-4-21 16:17:27 | F66: 490 | G66: 315 | H66: 164 | I66: =G66/F66 -> 0.6428571428571429 | J66: 5 | K66: =D66*J66/10 -> 132.5 | L66: =D66*H66 -> 43460 | M66: =L66*J66/10 -> 21730
A67: 短袖Ｔ恤 | B67: 5319 | C67: 100%棉/深紫色/淡蓝色/数码印花/印染效果/3扣翻领/短T恤 | D67: 295 | E67: 2010-7-24 17:34:13 | F67: 318 | G67: 169 | H67: 142 | I67: =G67/F67 -> 0.53144654088050314 | J67: 5 | K67: =D67*J67/10 -> 147.5 | L67: =D67*H67 -> 41890 | M67: =L67*J67/10 -> 20945
A68: 短袖Ｔ恤 | B68: 5223 | C68: 95%棉5%氨纶/丝光处理/黑色/立体胶印/短袖T恤 | D68: 265 | E68: 2010-5-1 14:09:25 | F68: 289 | G68: 149 | H68: 132 | I68: =G68/F68 -> 0.51557093425605538 | J68: 5 | K68: =D68*J68/10 -> 132.5 | L68: =D68*H68 -> 34980 | M68: =L68*J68/10 -> 17490
A69: 短袖Ｔ恤 | B69: 5295 | C69: 100%棉/黑色/鱼骨纹印花/短袖T恤/鱼骨纹印花/短袖T恤 | D69: 295 | E69: 2010-7-8 18:09:10 | F69: 320 | G69: 186 | H69: 128 | I69: =G69/F69 -> 0.58125000000000004 | J69: 5 | K69: =D69*J69/10 -> 147.5 | L69: =D69*H69 -> 37760 | M69: =L69*J69/10 -> 18880
A70: 短袖Ｔ恤 | B70: 5323 | C70: 95%棉5%氨纶/宝蓝色/烫钻/儿童短袖T恤 | D70: 165 | E70: 2010-4-13 16:08:43 | F70: 202 | G70: 87 | H70: 113 | I70: =G70/F70 -> 0.43069306930693069 | J70: 5 | K70: =D70*J70/10 -> 82.5 | L70: =D70*H70 -> 18645 | M70: =L70*J70/10 -> 9322.5
A71: 短袖Ｔ恤 | B71: 5251 | C71: 100%棉/浅花灰/紫色/蓝色/POLO领/短袖T恤 | D71: 265 | E71: 2010-4-14 18:03:50 | F71: 450 | G71: 373 | H71: 68 | I71: =G71/F71 -> 0.8288888888888889 | J71: 5 | K71: =D71*J71/10 -> 132.5 | L71: =D71*H71 -> 18020 | M71: =L71*J71/10 -> 9010
A72: 短袖Ｔ恤 | B72: 5212 | C72: 95%棉5%氨纶/丝光处理//紫色/立体胶印/短袖T恤 | D72: 265 | E72: 2010-5-1 14:03:17 | F72: 248 | G72: 179 | H72: 59 | I72: =G72/F72 -> 0.72177419354838712 | J72: 5 | K72: =D72*J72/10 -> 132.5 | L72: =D72*H72 -> 15635 | M72: =L72*J72/10 -> 7817.5
A73: 短袖Ｔ恤 | B73: 5260 | C73: 95%棉5%氨纶/茄紫色/印花/圆领/短袖T恤 | D73: 228 | E73: 2010-3-2 9:28:36 | F73: 303 | G73: 240 | H73: 57 | I73: =G73/F73 -> 0.79207920792079212 | J73: 5 | K73: =D73*J73/10 -> 114 | L73: =D73*H73 -> 12996 | M73: =L73*J73/10 -> 6498
A74: 短袖Ｔ恤 | B74: 5263 | C74: 天丝棉/黑色/铁灰/横条/短袖T恤 | D74: 325 | E74: 2010-3-5 17:51:27 | F74: 518 | G74: 455 | H74: 55 | I74: =G74/F74 -> 0.8783783783783784 | J74: 5 | K74: =D74*J74/10 -> 162.5 | L74: =D74*H74 -> 17875 | M74: =L74*J74/10 -> 8937.5
A75: 短袖Ｔ恤 | B75: 5071 | C75: 100%棉/灰蓝/白色/印花/白色翻领/短袖T恤 | D75: 265 | E75: 2010-8-14 15:26:54 | F75: 1076 | G75: 22 | H75: 1048 | I75: =G75/F75 -> 2.0446096654275093E-2 | J75: 5 | K75: =D75*J75/10 -> 132.5 | L75: =D75*H75 -> 277720 | M75: =L75*J75/10 -> 138860
A76: 短袖Ｔ恤 | B76: 5095 | C76: 100%棉/绿色/银灰/白/黑色/短袖T恤 | D76: 325 | E76: 2010-3-28 9:27:38 | F76: 2004 | G76: 949 | H76: 1043 | I76: =G76/F76 -> 0.47355289421157687 | J76: 5 | K76: =D76*J76/10 -> 162.5 | L76: =D76*H76 -> 338975 | M76: =L76*J76/10 -> 169487.5
A77: 短袖Ｔ恤 | B77: 5229 | C77: 100%棉/面料珠地工艺/海蓝/翻领/短袖T恤 | D77: 228 | E77: 2010-5-21 15:36:07 | F77: 519 | G77: 416 | H77: 95 | I77: =G77/F77 -> 0.80154142581888244 | J77: 5 | K77: =D77*J77/10 -> 114 | L77: =D77*H77 -> 21660 | M77: =L77*J77/10 -> 10830
A78: 短袖Ｔ恤 | B78: 5238 | C78: 95%棉5%氨纶/橄榄绿/印花/圆领/短袖T恤 | D78: 228 | E78: 2010-3-2 9:28:36 | F78: 301 | G78: 205 | H78: 90 | I78: =G78/F78 -> 0.68106312292358806 | J78: 5 | K78: =D78*J78/10 -> 114 | L78: =D78*H78 -> 20520 | M78: =L78*J78/10 -> 10260
A79: 短袖Ｔ恤 | B79: 5246 | C79: 100%棉/黑色/白色/横条提花/大循环/短袖T恤 | D79: 228 | E79: 2010-4-6 17:53:33 | F79: 317 | G79: 236 | H79: 80 | I79: =G79/F79 -> 0.74447949526813884 | J79: 5 | K79: =D79*J79/10 -> 114 | L79: =D79*H79 -> 18240 | M79: =L79*J79/10 -> 9120
A80: 短袖Ｔ恤 | B80: 5322 | C80: 95%棉5%氨纶/绚彩蓝/印花/圆领/短袖T恤 | D80: 228 | E80: 2010-3-2 9:28:36 | F80: 301 | G80: 213 | H80: 79 | I80: =G80/F80 -> 0.70764119601328901 | J80: 5 | K80: =D80*J80/10 -> 114 | L80: =D80*H80 -> 18012 | M80: =L80*J80/10 -> 9006
A81: 短袖Ｔ恤 | B81: 5299 | C81: 100%棉/花灰/横细间条/翻领/短袖T恤 | D81: 228 | E81: 2010-4-13 16:08:43 | F81: 457 | G81: 383 | H81: 69 | I81: =G81/F81 -> 0.83807439824945296 | J81: 5 | K81: =D81*J81/10 -> 114 | L81: =D81*H81 -> 15732 | M81: =L81*J81/10 -> 7866
A82: 短袖Ｔ恤 | B82: 5416 | C82: 100%棉/紫色/灰色/白色/横条/翻领/短袖T恤 | D82: 265 | E82: 2010-8-16 10:05:00 | F82: 1045 | G82: 1 | H82: 1043 | I82: =G82/F82 -> 9.5693779904306223E-4 | J82: 5 | K82: =D82*J82/10 -> 132.5 | L82: =D82*H82 -> 276395 | M82: =L82*J82/10 -> 138197.5
A83: 短袖Ｔ恤 | B83: 5279 | C83: 100%棉/印花/衬衫款/短袖T恤 | D83: 265 | E83: 2010-8-16 10:01:12 | F83: 1039 | G83: 7 | H83: 1031 | I83: =G83/F83 -> 6.7372473532242537E-3 | J83: 5 | K83: =D83*J83/10 -> 132.5 | L83: =D83*H83 -> 273215 | M83: =L83*J83/10 -> 136607.5
A84: 短袖Ｔ恤 | B84: 5293 | C84: 100%棉/紫色/白色/小马印花/衬衫款/短袖T恤 | D84: 265 | E84: 2010-8-16 10:01:12 | F84: 1032 | G84: 7 | H84: 1023 | I84: =G84/F84 -> 6.7829457364341084E-3 | J84: 5 | K84: =D84*J84/10 -> 132.5 | L84: =D84*H84 -> 271095 | M84: =L84*J84/10 -> 135547.5
A85: 短袖Ｔ恤 | B85: 5035 | C85: 100%棉/黑色/蓝色/紫色/方格/白色翻领/短袖T恤 | D85: 265 | E85: 2010-8-6 15:57:09 | F85: 1048 | G85: 19 | H85: 1010 | I85: =G85/F85 -> 1.8129770992366411E-2 | J85: 5 | K85: =D85*J85/10 -> 132.5 | L85: =D85*H85 -> 267650 | M85: =L85*J85/10 -> 133825
A86: 短袖Ｔ恤 | B86: 5097 | C86: 100%棉/深蓝/浅紫/净色/短袖T恤 | D86: 365 | E86: 2010-4-20 17:07:36 | F86: 1920 | G86: 966 | H86: 953 | I86: =G86/F86 -> 0.50312500000000004 | J86: 6 | K86: =D86*J86/10 -> 219 | L86: =D86*H86 -> 347845 | M86: =L86*J86/10 -> 208707
A87: 短袖Ｔ恤 | B87: 5096 | C87: 100%棉/浅花灰/彩条/POLO领/短袖T恤 | D87: 265 | E87: 2010-4-14 18:03:50 | F87: 2065 | G87: 1161 | H87: 893 | I87: =G87/F87 -> 0.56222760290556906 | J87: 6 | K87: =D87*J87/10 -> 159 | L87: =D87*H87 -> 236645 | M87: =L87*J87/10 -> 141987
A88: 短袖Ｔ恤 | B88: 5099 | C88: 100%棉/青色/白/雀蓝/格石蓝/短袖T恤 | D88: 295 | E88: 2010-3-28 9:27:38 | F88: 1501 | G88: 671 | H88: 826 | I88: =G88/F88 -> 0.447035309793471 | J88: 6 | K88: =D88*J88/10 -> 177 | L88: =D88*H88 -> 243670 | M88: =L88*J88/10 -> 146202
A89: 短袖Ｔ恤 | B89: 7505 | C89: 100%棉/砖红/黑色/灰色/横条/短袖T恤 | D89: 265 | E89: 2010-4-20 17:05:44 | F89: 1348 | G89: 544 | H89: 799 | I89: =G89/F89 -> 0.40356083086053413 | J89: 6 | K89: =D89*J89/10 -> 159 | L89: =D89*H89 -> 211735 | M89: =L89*J89/10 -> 127041
A90: 短袖Ｔ恤 | B90: 5093 | C90: 100%棉/黑色/绿色/黄色/印花/衬衫款/短袖T恤 | D90: 325 | E90: 2010-4-30 11:50:11 | F90: 1824 | G90: 1045 | H90: 763 | I90: =G90/F90 -> 0.57291666666666663 | J90: 6 | K90: =D90*J90/10 -> 195 | L90: =D90*H90 -> 247975 | M90: =L90*J90/10 -> 148785
A91: 短袖Ｔ恤 | B91: 5076 | C91: 100%棉/黑色/灰色/印花/衬衫款/短袖T恤 | D91: 325 | E91: 2010-4-7 17:32:57 | F91: 1242 | G91: 512 | H91: 725 | I91: =G91/F91 -> 0.41223832528180354 | J91: 6 | K91: =D91*J91/10 -> 195 | L91: =D91*H91 -> 235625 | M91: =L91*J91/10 -> 141375
A92: 短袖Ｔ恤 | B92: 5078 | C92: 100%棉/宝石蓝/漂白/连帽/短袖T恤 | D92: 265 | E92: 2010-4-6 15:05:08 | F92: 1463 | G92: 747 | H92: 705 | I92: =G92/F92 -> 0.51059466848940538 | J92: 6 | K92: =D92*J92/10 -> 159 | L92: =D92*H92 -> 186825 | M92: =L92*J92/10 -> 112095
A93: 短袖Ｔ恤 | B93: 5242 | C93: 100%棉/深蓝/花灰/横条/短袖T恤 | D93: 265 | E93: 2010-4-15 11:44:59 | F93: 1138 | G93: 567 | H93: 558 | I93: =G93/F93 -> 0.49824253075571179 | J93: 6 | K93: =D93*J93/10 -> 159 | L93: =D93*H93 -> 147870 | M93: =L93*J93/10 -> 88722
A94: 短袖Ｔ恤 | B94: 5241 | C94: 100%棉/靛蓝/绿色/竖条/短袖T恤 | D94: 295 | E94: 2010-4-1 18:00:02 | F94: 809 | G94: 323 | H94: 483 | I94: =G94/F94 -> 0.39925834363411622 | J94: 6 | K94: =D94*J94/10 -> 177 | L94: =D94*H94 -> 142485 | M94: =L94*J94/10 -> 85491
A95: 短袖Ｔ恤 | B95: 5420 | C95: 95%棉5%氨纶/深宝蓝/烫钻印/圆领/男式/短袖T恤 | D95: 228 | E95: 2010-4-29 18:09:24 | F95: 740 | G95: 300 | H95: 436 | I95: =G95/F95 -> 0.40540540540540543 | J95: 6 | K95: =D95*J95/10 -> 136.8 | L95: =D95*H95 -> 99408 | M95: =L95*J95/10 -> 59644.800000000003
A96: 短袖Ｔ恤 | B96: 5280 | C96: 100%棉/浅紫蓝/白色/细横条/翻领/短袖T恤 | D96: 295 | E96: 2010-5-20 17:38:57 | F96: 1125 | G96: 716 | H96: 406 | I96: =G96/F96 -> 0.63644444444444448 | J96: 6 | K96: =D96*J96/10 -> 177 | L96: =D96*H96 -> 119770 | M96: =L96*J96/10 -> 71862
A97: 短袖Ｔ恤 | B97: 5239 | C97: 100%棉/深海蓝/海洋蓝/扎孔/圆领/短袖T恤 | D97: 365 | E97: 2010-5-20 17:38:57 | F97: 915 | G97: 506 | H97: 400 | I97: =G97/F97 -> 0.55300546448087429 | J97: 6 | K97: =D97*J97/10 -> 219 | L97: =D97*H97 -> 146000 | M97: =L97*J97/10 -> 87600
A98: 短袖Ｔ恤 | B98: 5257 | C98: 100%棉/深蓝/紫红/灰色/横间条/立翻领/短袖T恤 | D98: 265 | E98: 2010-3-12 17:29:06 | F98: 879 | G98: 474 | H98: 396 | I98: =G98/F98 -> 0.53924914675767921 | J98: 6 | K98: =D98*J98/10 -> 159 | L98: =D98*H98 -> 104940 | M98: =L98*J98/10 -> 62964
A99: 短袖Ｔ恤 | B99: 5269 | C99: 莱卡棉/Burberry博柏丽条纹/白色领子/英国风格/短袖T恤 | D99: 268 | E99: 2010-4-30 15:41:07 | F99: 1002 | G99: 604 | H99: 390 | I99: =G99/F99 -> 0.60279441117764476 | J99: 6 | K99: =D99*J99/10 -> 160.8 | L99: =D99*H99 -> 104520 | M99: =L99*J99/10 -> 62712
A100: 短袖Ｔ恤 | B100: 5305 | C100: 100%棉/面料双面丝光处理/紫色/绣花/翻领/短袖T恤 | D100: 265 | E100: 2010-4-13 16:08:43 | F100: 820 | G100: 458 | H100: 353 | I100: =G100/F100 -> 0.55853658536585371 | J100: 6 | K100: =D100*J100/10 -> 159 | L100: =D100*H100 -> 93545 | M100: =L100*J100/10 -> 56127
A101: 短袖Ｔ恤 | B101: 5311 | C101: 100%棉/宝蓝色/草绿横条/短袖T恤 | D101: 188 | E101: 2010-5-15 17:55:56 | F101: 1506 | G101: 1167 | H101: 327 | I101: =G101/F101 -> 0.77490039840637448 | J101: 6 | K101: =D101*J101/10 -> 112.8 | L101: =D101*H101 -> 61476 | M101: =L101*J101/10 -> 36885.599999999999
A102: 短袖Ｔ恤 | B102: 5265 | C102: 100%棉/紫色/黑色/横条/双层领/短袖T恤 | D102: 295 | E102: 2010-4-1 18:00:02 | F102: 1334 | G102: 1020 | H102: 307 | I102: =G102/F102 -> 0.7646176911544228 | J102: 6 | K102: =D102*J102/10 -> 177 | L102: =D102*H102 -> 90565 | M102: =L102*J102/10 -> 54339
A103: 短袖Ｔ恤 | B103: 5276 | C103: 100%棉/灰色/黑色/白色/横条/短袖T恤 | D103: 265 | E103: 2010-4-15 16:05:50 | F103: 609 | G103: 309 | H103: 295 | I103: =G103/F103 -> 0.5073891625615764 | J103: 6 | K103: =D103*J103/10 -> 159 | L103: =D103*H103 -> 78175 | M103: =L103*J103/10 -> 46905
A104: 短袖Ｔ恤 | B104: 5213 | C104: 莱卡棉/英国博柏丽Burberry条纹/天蓝色/白色领子/横条纹/短袖T恤 | D104: 268 | E104: 2010-4-30 15:41:07 | F104: 1024 | G104: 718 | H104: 291 | I104: =G104/F104 -> 0.701171875 | J104: 6 | K104: =D104*J104/10 -> 160.8 | L104: =D104*H104 -> 77988 | M104: =L104*J104/10 -> 46792.800000000003
A105: 短袖Ｔ恤 | B105: 5290 | C105: 100%棉/雀蓝色/白色/黑色/横条/双领/短袖T恤 | D105: 295 | E105: 2010-4-30 11:50:11 | F105: 713 | G105: 411 | H105: 288 | I105: =G105/F105 -> 0.57643758765778397 | J105: 6 | K105: =D105*J105/10 -> 177 | L105: =D105*H105 -> 84960 | M105: =L105*J105/10 -> 50976
A106: 短袖Ｔ恤 | B106: 5215 | C106: 70%莱赛尔纤维/10%桑蚕丝/黑色/白色/横条提花/短袖/T恤 | D106: 365 | E106: 2010-3-25 11:16:05 | F106: 731 | G106: 438 | H106: 288 | I106: =G106/F106 -> 0.59917920656634749 | J106: 6 | K106: =D106*J106/10 -> 219 | L106: =D106*H106 -> 105120 | M106: =L106*J106/10 -> 63072
A107: 短袖Ｔ恤 | B107: 5221 | C107: 100%棉/浅花灰/紫色/蓝色/圆领/短袖T恤 | D107: 228 | E107: 2010-4-14 18:03:50 | F107: 669 | G107: 390 | H107: 275 | I107: =G107/F107 -> 0.5829596412556054 | J107: 6 | K107: =D107*J107/10 -> 136.8 | L107: =D107*H107 -> 62700 | M107: =L107*J107/10 -> 37620
A108: 短袖Ｔ恤 | B108: 5288 | C108: 100%棉/细腻双珠地织法/米白/灰/灰绿/深绿/翻领/大横条/短袖T恤 | D108: 265 | E108: 2010-5-21 17:48:45 | F108: 829 | G108: 588 | H108: 239 | I108: =G108/F108 -> 0.7092882991556092 | J108: 6 | K108: =D108*J108/10 -> 159 | L108: =D108*H108 -> 63335 | M108: =L108*J108/10 -> 38001
A109: 短袖Ｔ恤 | B109: 5245 | C109: 100%棉/黑色/紫红/印花/衬衫款/短袖T恤 | D109: 325 | E109: 2010-4-30 11:50:11 | F109: 696 | G109: 509 | H109: 178 | I109: =G109/F109 -> 0.73132183908045978 | J109: 6 | K109: =D109*J109/10 -> 195 | L109: =D109*H109 -> 57850 | M109: =L109*J109/10 -> 34710
A110: 短袖Ｔ恤 | B110: 5291 | C110: 100%棉/细腻双珠地织法/紫色/宽间条/短袖/T恤 | D110: 265 | E110: 2010-5-31 17:43:08 | F110: 521 | G110: 377 | H110: 143 | I110: =G110/F110 -> 0.72360844529750479 | J110: 6 | K110: =D110*J110/10 -> 159 | L110: =D110*H110 -> 37895 | M110: =L110*J110/10 -> 22737
A111: 短袖Ｔ恤 | B111: 5227 | C111: 100%棉/青色/白/雪青/紫色/短袖T恤 | D111: 295 | E111: 2010-3-28 9:27:38 | F111: 506 | G111: 373 | H111: 130 | I111: =G111/F111 -> 0.73715415019762842 | J111: 6 | K111: =D111*J111/10 -> 177 | L111: =D111*H111 -> 38350 | M111: =L111*J111/10 -> 23010
A112: 短袖Ｔ恤 | B112: 5267 | C112: 100%棉/灰色/水印花/翻领/短袖T恤 | D112: 265 | E112: 2010-3-12 17:29:06 | F112: 469 | G112: 338 | H112: 129 | I112: =G112/F112 -> 0.72068230277185497 | J112: 6 | K112: =D112*J112/10 -> 159 | L112: =D112*H112 -> 34185 | M112: =L112*J112/10 -> 20511
A113: 短袖Ｔ恤 | B113: 5317 | C113: 天丝棉/深紫色/米白/横条/短袖T恤 | D113: 325 | E113: 2010-3-5 17:51:27 | F113: 510 | G113: 386 | H113: 123 | I113: =G113/F113 -> 0.75686274509803919 | J113: 6 | K113: =D113*J113/10 -> 195 | L113: =D113*H113 -> 39975 | M113: =L113*J113/10 -> 23985
A114: 短袖Ｔ恤 | B114: 5427 | C114: 100%棉/草绿色/蓝色细横条/短袖T恤 | D114: 188 | E114: 2010-5-15 17:55:56 | F114: 1676 | G114: 921 | H114: 742 | I114: =G114/F114 -> 0.5495226730310262 | J114: 6 | K114: =D114*J114/10 -> 112.8 | L114: =D114*H114 -> 139496 | M114: =L114*J114/10 -> 83697.600000000006
A115: 短袖Ｔ恤 | B115: 5077 | C115: 100%棉/黑色/白色/翻领/横条/短袖T恤 | D115: 295 | E115: 2010-5-4 16:09:57 | F115: 1469 | G115: 787 | H115: 662 | I115: =G115/F115 -> 0.53573859768550036 | J115: 6 | K115: =D115*J115/10 -> 177 | L115: =D115*H115 -> 195290 | M115: =L115*J115/10 -> 117174
A116: 短袖Ｔ恤 | B116: 5240 | C116: 100%棉/宝蓝色/白色横条/短袖T恤 | D116: 188 | E116: 2010-5-15 17:55:56 | F116: 1514 | G116: 992 | H116: 508 | I116: =G116/F116 -> 0.65521796565389701 | J116: 6 | K116: =D116*J116/10 -> 112.8 | L116: =D116*H116 -> 95504 | M116: =L116*J116/10 -> 57302.400000000001
A117: 短袖Ｔ恤 | B117: 5310 | C117: 100%棉/铁灰/白色/黑色/翻领/短袖T恤 | D117: 265 | E117: 2010-8-14 17:05:52 | F117: 997 | G117: 8 | H117: 987 | I117: =G117/F117 -> 8.0240722166499499E-3 | J117: 6 | K117: =D117*J117/10 -> 159 | L117: =D117*H117 -> 261555 | M117: =L117*J117/10 -> 156933
A118: 短袖Ｔ恤 | B118: 5098 | C118: 100%棉/蓝色/黑色/白色/横条/白色翻领/短袖T恤 | D118: 265 | E118: 2010-8-16 10:05:00 | F118: 1000 | G118: 10 | H118: 986 | I118: =G118/F118 -> 0.01 | J118: 6 | K118: =D118*J118/10 -> 159 | L118: =D118*H118 -> 261290 | M118: =L118*J118/10 -> 156774
A119: 短袖Ｔ恤 | B119: 5091 | C119: 深蓝/银灰/白/黑色/牛仔蓝/高支精疏棉/短袖T恤 | D119: 325 | E119: 2010-8-12 1:09:22 | F119: 805 | G119: 2 | H119: 801 | I119: =G119/F119 -> 2.4844720496894411E-3 | J119: 6 | K119: =D119*J119/10 -> 195 | L119: =D119*H119 -> 260325 | M119: =L119*J119/10 -> 156195
A120: 短袖Ｔ恤 | B120: 7501 | C120: 深蓝色/银灰/高支精疏棉/立领短袖T恤 | D120: 325 | E120: 2010-8-12 1:09:22 | F120: 798 | G120: 0 | H120: 797 | I120: =G120/F120 -> 0 | J120: 6 | K120: =D120*J120/10 -> 195 | L120: =D120*H120 -> 259025 | M120: =L120*J120/10 -> 155415
A121: 短袖Ｔ恤 | B121: 5426 | C121: 100%棉/中灰/深紫/横条/翻领/短袖T恤 | D121: 265 | E121: 2010-7-19 17:56:50 | F121: 1093 | G121: 335 | H121: 746 | I121: =G121/F121 -> 0.30649588289112534 | J121: 6 | K121: =D121*J121/10 -> 159 | L121: =D121*H121 -> 197690 | M121: =L121*J121/10 -> 118614
A122: 短袖Ｔ恤 | B122: 5226 | C122: 100%棉/黑色/绿色/紫色/方格/白色翻领/短袖T恤 | D122: 265 | E122: 2010-8-6 15:57:09 | F122: 518 | G122: 14 | H122: 502 | I122: =G122/F122 -> 2.7027027027027029E-2 | J122: 6 | K122: =D122*J122/10 -> 159 | L122: =D122*H122 -> 133030 | M122: =L122*J122/10 -> 79818
A123: 短袖Ｔ恤 | B123: 5277 | C123: 100%棉/白色/黑色/绿色/横条/翻领/短袖T恤 | D123: 265 | E123: 2010-8-14 15:26:54 | F123: 512 | G123: 13 | H123: 496 | I123: =G123/F123 -> 2.5390625E-2 | J123: 6 | K123: =D123*J123/10 -> 159 | L123: =D123*H123 -> 131440 | M123: =L123*J123/10 -> 78864
A124: 短袖Ｔ恤 | B124: 5258 | C124: 100%棉/白色/净色/翻领/短袖T恤 | D124: 265 | E124: 2010-8-17 16:42:33 | F124: 428 | G124: 3 | H124: 421 | I124: =G124/F124 -> 7.0093457943925233E-3 | J124: 6 | K124: =D124*J124/10 -> 159 | L124: =D124*H124 -> 111565 | M124: =L124*J124/10 -> 66939
A125: 短袖Ｔ恤 | B125: 5289 | C125: 100%棉/绿色/蓝色/玫红/印花/衬衫款/短袖T恤 | D125: 295 | E125: 2010-8-14 16:59:53 | F125: 323 | G125: 6 | H125: 316 | I125: =G125/F125 -> 1.8575851393188854E-2 | J125: 6 | K125: =D125*J125/10 -> 177 | L125: =D125*H125 -> 93220 | M125: =L125*J125/10 -> 55932
A126: 短袖Ｔ恤 | B126: 5217 | C126: 100%棉/深蓝色/中蓝色/间条/白色梭织面料3扣翻领/短袖T恤 | D126: 295 | E126: 2010-7-3 17:33:37 | F126: 353 | G126: 104 | H126: 247 | I126: =G126/F126 -> 0.29461756373937675 | J126: 6 | K126: =D126*J126/10 -> 177 | L126: =D126*H126 -> 72865 | M126: =L126*J126/10 -> 43719
A127: 短袖Ｔ恤 | B127: 5296 | C127: 100%棉/卡其/白色/黑色/绿色/横条条纹/翻白领/短袖T恤 | D127: 265 | E127: 0 | F127: 4 | G127: 0 | H127: 3 | I127: =G127/F127 -> 0 | J127: 6 | K127: =D127*J127/10 -> 159 | L127: =D127*H127 -> 795 | M127: =L127*J127/10 -> 477
A128: 短袖Ｔ恤 | B128: 5318 | C128: 100%棉/紫色/白色/彩条/横条条纹/翻白领/短袖T恤 | D128: 265 | E128: 0 | F128: 4 | G128: 0 | H128: 3 | I128: =G128/F128 -> 0 | J128: 6 | K128: =D128*J128/10 -> 159 | L128: =D128*H128 -> 795 | M128: =L128*J128/10 -> 477
A129: 短袖Ｔ恤 | B129: 5425 | C129: 100%棉/浅蓝/白色/彩条/横条条纹/翻白领/短袖T恤 | D129: 265 | E129: 0 | F129: 4 | G129: 0 | H129: 3 | I129: =G129/F129 -> 0 | J129: 6 | K129: =D129*J129/10 -> 159 | L129: =D129*H129 -> 795 | M129: =L129*J129/10 -> 477
A130: 短袖Ｔ恤 | B130: 5464 | C130: 100%棉/浅蓝/白色/黑色/横条条纹/翻白领/短袖T恤 | D130: 265 | E130: 0 | F130: 4 | G130: 0 | H130: 2 | I130: =G130/F130 -> 0 | J130: 6 | K130: =D130*J130/10 -> 159 | L130: =D130*H130 -> 530 | M130: =L130*J130/10 -> 318
A131: 短袖Ｔ恤 | B131: 5466 | C131: 100%棉/黑色/净色/翻领/短袖T恤 | D131: 265 | E131: 0 | F131: 3 | G131: 1 | H131: 2 | I131: =G131/F131 -> 0.33333333333333331 | J131: 6 | K131: =D131*J131/10 -> 159 | L131: =D131*H131 -> 530 | M131: =L131*J131/10 -> 318
L132: =SUM(L2:L131) -> 15767524 | M132: =SUM(M2:M131) -> 8370590.4999999991 | N132: =M132/L132 -> 0.53087539299131548
A134: 品名 | B134: 款号 | C134: 名称 | D134: 价格 | E134: 日期 | F134: 入库 | G134: 销售 | H134: 库存 | I134: 产销比 | J134: 折扣 | K134: 折后价 | L134: 原总价 | M134: 折后总价
A135: 短袖衬衫 | B135: 3315 | C135: 100%棉/100支双股/白色/条纹提花/短袖衬衫 | D135: 168 | E135: 2010-6-14 17:48:45 | F135: 236 | G135: 227 | H135: 1 | I135: =G135/F135 -> 0.96186440677966101 | J135: 3 | K135: =D135*J135/10 -> 50.4 | L135: =D135*H135 -> 168 | M135: =D135*J135*H135/10 -> 50.4
A136: 短袖衬衫 | B136: 3311 | C136: 浅蓝色/蓝色/条纹/短袖衬衫 | D136: 135 | E136: 2010-6-14 17:48:45 | F136: 118 | G136: 109 | H136: 9 | I136: =G136/F136 -> 0.92372881355932202 | J136: 3 | K136: =D136*J136/10 -> 40.5 | L136: =D136*H136 -> 1215 | M136: =D136*J136*H136/10 -> 364.5
A137: 短袖衬衫 | B137: 3317 | C137: 白色/条纹提花/短袖衬衫 | D137: 120 | E137: 2010-6-14 17:48:45 | F137: 78 | G137: 70 | H137: 6 | I137: =G137/F137 -> 0.89743589743589747 | J137: 3 | K137: =D137*J137/10 -> 36 | L137: =D137*H137 -> 720 | M137: =D137*J137*H137/10 -> 216
A138: 短袖衬衫 | B138: 3312 | C138: 浅蓝色/蓝色/小格子/短袖衬衫 | D138: 168 | E138: 2010-6-29 14:48:33 | F138: 107 | G138: 96 | H138: 10 | I138: =G138/F138 -> 0.89719626168224298 | J138: 3 | K138: =D138*J138/10 -> 50.4 | L138: =D138*H138 -> 1680 | M138: =D138*J138*H138/10 -> 504
A139: 短袖衬衫 | B139: 3207 | C139: 100%棉/80支双股/白色/紫色/黑色/格子/短袖衬衫 | D139: 268 | E139: 2010-6-14 17:48:45 | F139: 874 | G139: 729 | H139: 120 | I139: =G139/F139 -> 0.83409610983981697 | J139: 4 | K139: =D139*J139/10 -> 107.2 | L139: =D139*H139 -> 32160 | M139: =D139*J139*H139/10 -> 12864
A140: 短袖衬衫 | B140: 3184 | C140: 100%棉/90支双股/浅蓝色/条纹/短袖衬衫 | D140: 265 | E140: 2010-2-8 18:54:18 | F140: 953 | G140: 765 | H140: 176 | I140: =G140/F140 -> 0.80272822665267574 | J140: 4 | K140: =D140*J140/10 -> 106 | L140: =D140*H140 -> 46640 | M140: =D140*J140*H140/10 -> 18656
A141: 短袖衬衫 | B141: 3201 | C141: 23.1%丝76.9%棉/白色/紫色/蓝色/条纹提花/短袖衬衫 | D141: 298 | E141: 2010-7-10 17:48:04 | F141: 412 | G141: 174 | H141: 238 | I141: =G141/F141 -> 0.42233009708737862 | J141: 4 | K141: =D141*J141/10 -> 119.2 | L141: =D141*H141 -> 70924 | M141: =D141*J141*H141/10 -> 28369.599999999999
A142: 短袖衬衫 | B142: 3186 | C142: 23.5%丝76.5%棉/100支双股/白色/紫色/提花/短袖衬衫 | D142: 298 | E142: 2010-7-9 17:46:26 | F142: 422 | G142: 171 | H142: 252 | I142: =G142/F142 -> 0.40521327014218012 | J142: 4 | K142: =D142*J142/10 -> 119.2 | L142: =D142*H142 -> 75096 | M142: =D142*J142*H142/10 -> 30038.400000000001
A143: 短袖衬衫 | B143: 3313 | C143: 100%棉/80支纱/白色/条纹提花/短袖衬衫 | D143: 268 | E143: 2010-6-14 17:48:45 | F143: 373 | G143: 115 | H143: 246 | I143: =G143/F143 -> 0.30831099195710454 | J143: 4 | K143: =D143*J143/10 -> 107.2 | L143: =D143*H143 -> 65928 | M143: =D143*J143*H143/10 -> 26371.200000000001
A144: 短袖衬衫 | B144: 3209 | C144: 100%棉/100支双股/浅蓝色/条纹/大提花/短袖衬衫 | D144: 368 | E144: 2010-6-13 16:52:18 | F144: 353 | G144: 88 | H144: 254 | I144: =G144/F144 -> 0.24929178470254956 | J144: 4 | K144: =D144*J144/10 -> 147.2 | L144: =D144*H144 -> 93472 | M144: =D144*J144*H144/10 -> 37388.800000000003
A145: 短袖衬衫 | B145: 3188 | C145: 23.5%丝76.5%棉/100支双股/白色/蓝色/提花/短袖衬衫 | D145: 268 | E145: 2010-7-9 17:46:26 | F145: 460 | G145: 155 | H145: 303 | I145: =G145/F145 -> 0.33695652173913043 | J145: 5 | K145: =D145*J145/10 -> 134 | L145: =D145*H145 -> 81204 | M145: =D145*J145*H145/10 -> 40602
A146: 短袖衬衫 | B146: 3217 | C146: 100%棉/120支双股/白色/蓝色/小方格/短袖衬衫 | D146: 398 | E146: 2010-6-12 17:30:50 | F146: 686 | G146: 351 | H146: 327 | I146: =G146/F146 -> 0.51166180758017488 | J146: 5 | K146: =D146*J146/10 -> 199 | L146: =D146*H146 -> 130146 | M146: =D146*J146*H146/10 -> 65073
A147: 短袖衬衫 | B147: 3192 | C147: 100%棉/100支双股/白色/紫色/短袖衬衫 | D147: 268 | E147: 2010-7-9 17:58:17 | F147: 435 | G147: 102 | H147: 333 | I147: =G147/F147 -> 0.23448275862068965 | J147: 5 | K147: =D147*J147/10 -> 134 | L147: =D147*H147 -> 89244 | M147: =D147*J147*H147/10 -> 44622
A148: 短袖衬衫 | B148: 3200 | C148: 22%丝78%棉/120支纱双股/紫色/蓝绿/细条/短袖衬衫 | D148: 298 | E148: 2010-7-9 17:58:17 | F148: 854 | G148: 159 | H148: 692 | I148: =G148/F148 -> 0.18618266978922718 | J148: 5 | K148: =D148*J148/10 -> 149 | L148: =D148*H148 -> 206216 | M148: =D148*J148*H148/10 -> 103108
A149: 短袖衬衫 | B149: 3194 | C149: 22%丝78%棉/白色/紫色/竖条纹/真丝棉/短袖衬衫 | D149: 298 | E149: 2010-7-10 10:03:44 | F149: 856 | G149: 131 | H149: 721 | I149: =G149/F149 -> 0.1530373831775701 | J149: 5 | K149: =D149*J149/10 -> 149 | L149: =D149*H149 -> 214858 | M149: =D149*J149*H149/10 -> 107429
A150: 短袖衬衫 | B150: 3199 | C150: 100%棉/100支纱双股/紫色/蓝色/细条/短袖衬衫 | D150: 268 | E150: 2010-7-10 17:37:38 | F150: 875 | G150: 138 | H150: 735 | I150: =G150/F150 -> 0.15771428571428572 | J150: 5 | K150: =D150*J150/10 -> 134 | L150: =D150*H150 -> 196980 | M150: =D150*J150*H150/10 -> 98490
A151: 短袖衬衫 | B151: 3202 | C151: 100%棉/100支双股/白色/蓝色/条纹/短袖衬衫 | D151: 268 | E151: 2010-6-7 17:32:01 | F151: 600 | G151: 130 | H151: 456 | I151: =G151/F151 -> 0.21666666666666667 | J151: 5 | K151: =D151*J151/10 -> 134 | L151: =D151*H151 -> 122208 | M151: =D151*J151*H151/10 -> 61104
A152: 短袖衬衫 | B152: 3195 | C152: 21.9%丝78.1%棉/120支纱/紫色/条纹/短袖衬衫 | D152: 298 | E152: 2010-6-8 17:54:39 | F152: 772 | G152: 183 | H152: 575 | I152: =G152/F152 -> 0.23704663212435234 | J152: 5 | K152: =D152*J152/10 -> 149 | L152: =D152*H152 -> 171350 | M152: =D152*J152*H152/10 -> 85675
A153: 短袖衬衫 | B153: 3196 | C153: 22%丝、78%棉/120支纱/深紫色/细条纹/短袖衬衫 | D153: 298 | E153: 2010-6-8 15:05:54 | F153: 786 | G153: 179 | H153: 593 | I153: =G153/F153 -> 0.22773536895674301 | J153: 5 | K153: =D153*J153/10 -> 149 | L153: =D153*H153 -> 176714 | M153: =D153*J153*H153/10 -> 88357
A154: 短袖衬衫 | B154: 3214 | C154: 100%棉/100支双股/白色/蓝色/大提花/短袖衬衫 | D154: 398 | E154: 2010-6-12 17:30:50 | F154: 710 | G154: 173 | H154: 525 | I154: =G154/F154 -> 0.24366197183098592 | J154: 5 | K154: =D154*J154/10 -> 199 | L154: =D154*H154 -> 208950 | M154: =D154*J154*H154/10 -> 104475
A155: 短袖衬衫 | B155: 3208 | C155: 100%棉/100支双股/白色/蓝色/条纹/大提花/短袖衬衫 | D155: 368 | E155: 2010-6-13 16:52:18 | F155: 821 | G155: 232 | H155: 578 | I155: =G155/F155 -> 0.28258221680876977 | J155: 5 | K155: =D155*J155/10 -> 184 | L155: =D155*H155 -> 212704 | M155: =D155*J155*H155/10 -> 106352
A156: 短袖衬衫 | B156: 3285 | C156: 78%棉22%丝/白色/蓝色/条纹/短袖衬衫 | D156: 298 | E156: 2010-6-30 15:15:52 | F156: 826 | G156: 211 | H156: 600 | I156: =G156/F156 -> 0.25544794188861986 | J156: 6 | K156: =D156*J156/10 -> 178.8 | L156: =D156*H156 -> 178800 | M156: =D156*J156*H156/10 -> 107280
A157: 短袖衬衫 | B157: 3205 | C157: 100%棉/120支纱双股/白色/紫色/蓝色/条纹/短袖衬衫 | D157: 268 | E157: 2010-6-7 18:04:06 | F157: 866 | G157: 237 | H157: 619 | I157: =G157/F157 -> 0.27367205542725176 | J157: 6 | K157: =D157*J157/10 -> 160.8 | L157: =D157*H157 -> 165892 | M157: =D157*J157*H157/10 -> 99535.2
A158: 短袖衬衫 | B158: 3203 | C158: 100%棉/140支双股/白色/蓝色/条纹/短袖衬衫 | D158: 298 | E158: 2010-6-7 17:32:01 | F158: 819 | G158: 265 | H158: 542 | I158: =G158/F158 -> 0.32356532356532358 | J158: 6 | K158: =D158*J158/10 -> 178.8 | L158: =D158*H158 -> 161516 | M158: =D158*J158*H158/10 -> 96909.6
A159: 短袖衬衫 | B159: 3204 | C159: 100%棉/140支双股/蓝色/条纹/短袖衬衫 | D159: 298 | E159: 2010-6-8 16:15:14 | F159: 890 | G159: 286 | H159: 594 | I159: =G159/F159 -> 0.32134831460674157 | J159: 6 | K159: =D159*J159/10 -> 178.8 | L159: =D159*H159 -> 177012 | M159: =D159*J159*H159/10 -> 106207.2
A160: 短袖衬衫 | B160: 3213 | C160: 100%棉/80支纱/博百利格纹/大提花/短袖衬衫 | D160: 298 | E160: 2010-6-12 17:30:50 | F160: 611 | G160: 179 | H160: 418 | I160: =G160/F160 -> 0.29296235679214405 | J160: 6 | K160: =D160*J160/10 -> 178.8 | L160: =D160*H160 -> 124564 | M160: =D160*J160*H160/10 -> 74738.399999999994
A161: 短袖衬衫 | B161: 3193 | C161: 100%棉/100支双股/白色/蓝色/条纹/短袖衬衫 | D161: 268 | E161: 2010-7-10 17:43:03 | F161: 868 | G161: 425 | H161: 442 | I161: =G161/F161 -> 0.48963133640552997 | J161: 6 | K161: =D161*J161/10 -> 160.8 | L161: =D161*H161 -> 118456 | M161: =D161*J161*H161/10 -> 71073.600000000006
A162: 短袖衬衫 | B162: 3198 | C162: 真丝棉/白色/提花/短袖衬衫 | D162: 298 | E162: 2010-7-9 17:58:17 | F162: 684 | G162: 224 | H162: 462 | I162: =G162/F162 -> 0.32748538011695905 | J162: 6 | K162: =D162*J162/10 -> 178.8 | L162: =D162*H162 -> 137676 | M162: =D162*J162*H162/10 -> 82605.600000000006
A163: 短袖衬衫 | B163: 3166 | C163: 100%棉/海兰色/印花/休闲短袖衬衫 | D163: 268 | E163: 2010-4-12 15:33:01 | F163: 1499 | G163: 1023 | H163: 474 | I163: =G163/F163 -> 0.68245496997998667 | J163: 6 | K163: =D163*J163/10 -> 160.8 | L163: =D163*H163 -> 127032 | M163: =D163*J163*H163/10 -> 76219.199999999997
A164: 短袖衬衫 | B164: 3190 | C164: 100%棉/100支双股/白色/蓝色/条纹/短袖衬衫 | D164: 268 | E164: 2010-7-9 17:46:26 | F164: 864 | G164: 282 | H164: 580 | I164: =G164/F164 -> 0.3263888888888889 | J164: 6 | K164: =D164*J164/10 -> 160.8 | L164: =D164*H164 -> 155440 | M164: =D164*J164*H164/10 -> 93264
L165: =SUM(L135:L164) -> 3544965 | M165: =SUM(M135:M164) -> 1867942.7 | N165: =M165/L165 -> 0.52692838998410418
A167: 品名 | B167: 款号 | C167: 名称 | D167: 价格 | E167: 日期 | F167: 入库 | G167: 销售 | H167: 库存 | I167: 产销比 | J167: 折扣 | K167: 折后价 | L167: 原总价 | M167: 折后总价
A168: 凉鞋 | B168: 2491 | C168: 防滑橡胶底/牛皮带/舒适凉鞋 | D168: 115 | E168: 2009-5-31 15:23:21 | F168: 249 | G168: 243 | H168: 1 | I168: =G168/F168 -> 0.97590361445783136 | J168: 3 | K168: =D168*J168/10 -> 34.5 | L168: =D168*H168 -> 115 | M168: =D168*J168*H168/10 -> 34.5
A169: 凉鞋 | B169: 4068 | C169: 男款凉拖细纹小牛皮/黑色/全牛里/舒适橡筋底/凉鞋 | D169: 285 | E169: 2010-5-20 9:29:41 | F169: 300 | G169: 290 | H169: 1 | I169: =G169/F169 -> 0.96666666666666667 | J169: 3 | K169: =D169*J169/10 -> 85.5 | L169: =D169*H169 -> 285 | M169: =D169*J169*H169/10 -> 85.5
A170: 凉鞋 | B170: 4165 | C170: 黑色/白色/夹角/凉拖 | D170: 195 | E170: 2010-6-24 16:34:30 | F170: 100 | G170: 98 | H170: 1 | I170: =G170/F170 -> 0.98 | J170: 3 | K170: =D170*J170/10 -> 58.5 | L170: =D170*H170 -> 195 | M170: =D170*J170*H170/10 -> 58.5
A171: 凉鞋 | B171: 4175 | C171: 白色/牛皮/凉鞋 | D171: 268 | E171: 2010-6-23 17:30:34 | F171: 80 | G171: 78 | H171: 1 | I171: =G171/F171 -> 0.97499999999999998 | J171: 3 | K171: =D171*J171/10 -> 80.4 | L171: =D171*H171 -> 268 | M171: =D171*J171*H171/10 -> 80.4
A172: 凉鞋 | B172: 4172 | C172: 牛皮/黑色/夹脚/凉拖 | D172: 268 | E172: 2010-6-23 17:30:34 | F172: 100 | G172: 98 | H172: 1 | I172: =G172/F172 -> 0.98 | J172: 3 | K172: =D172*J172/10 -> 80.4 | L172: =D172*H172 -> 268 | M172: =D172*J172*H172/10 -> 80.4
A173: 凉鞋 | B173: 4173 | C173: 黑色/牛皮/凉鞋 | D173: 268 | E173: 2010-6-23 17:30:34 | F173: 100 | G173: 96 | H173: 1 | I173: =G173/F173 -> 0.96 | J173: 3 | K173: =D173*J173/10 -> 80.4 | L173: =D173*H173 -> 268 | M173: =D173*J173*H173/10 -> 80.4
A174: 凉鞋 | B174: 4496 | C174: 牛皮/黑色/压花/凉鞋 | D174: 285 | E174: 2010-7-19 17:47:44 | F174: 200 | G174: 195 | H174: 2 | I174: =G174/F174 -> 0.97499999999999998 | J174: 3 | K174: =D174*J174/10 -> 85.5 | L174: =D174*H174 -> 570 | M174: =D174*J174*H174/10 -> 171
A175: 凉鞋 | B175: 4170 | C175: 牛皮/黑色/凉拖 | D175: 195 | E175: 2010-6-24 16:34:30 | F175: 100 | G175: 97 | H175: 2 | I175: =G175/F175 -> 0.97 | J175: 3 | K175: =D175*J175/10 -> 58.5 | L175: =D175*H175 -> 390 | M175: =D175*J175*H175/10 -> 117
A176: 凉鞋 | B176: 4180 | C176: 帆布/迷彩/深蓝/凉拖 | D176: 180 | E176: 2010-6-23 17:20:15 | F176: 100 | G176: 93 | H176: 4 | I176: =G176/F176 -> 0.93 | J176: 3 | K176: =D176*J176/10 -> 54 | L176: =D176*H176 -> 720 | M176: =D176*J176*H176/10 -> 216
A177: 凉鞋 | B177: 4181 | C177: 帆布/迷彩/黄色/凉拖 | D177: 180 | E177: 2010-6-23 17:20:15 | F177: 99 | G177: 93 | H177: 4 | I177: =G177/F177 -> 0.93939393939393945 | J177: 3 | K177: =D177*J177/10 -> 54 | L177: =D177*H177 -> 720 | M177: =D177*J177*H177/10 -> 216
A178: 凉鞋 | B178: 4171 | C178: 牛皮/白色/夹脚/凉拖 | D178: 268 | E178: 2010-6-23 17:30:34 | F178: 80 | G178: 74 | H178: 5 | I178: =G178/F178 -> 0.92500000000000004 | J178: 3 | K178: =D178*J178/10 -> 80.4 | L178: =D178*H178 -> 1340 | M178: =D178*J178*H178/10 -> 402
A179: 凉鞋 | B179: 4174 | C179: 牛皮/白色/夹脚/凉拖 | D179: 268 | E179: 2010-6-23 17:20:15 | F179: 80 | G179: 60 | H179: 18 | I179: =G179/F179 -> 0.75 | J179: 4 | K179: =D179*J179/10 -> 107.2 | L179: =D179*H179 -> 4824 | M179: =D179*J179*H179/10 -> 1929.6
A180: 凉鞋 | B180: 4179 | C180: 迷彩/深咖/夹脚/凉拖 | D180: 98 | E180: 2010-6-23 17:20:15 | F180: 100 | G180: 70 | H180: 29 | I180: =G180/F180 -> 0.7 | J180: 4 | K180: =D180*J180/10 -> 39.2 | L180: =D180*H180 -> 2842 | M180: =D180*J180*H180/10 -> 1136.8
A181: 凉鞋 | B181: 4177 | C181: 帆布/迷彩/咖啡/夹脚/凉拖 | D181: 180 | E181: 2010-6-23 17:20:15 | F181: 100 | G181: 63 | H181: 35 | I181: =G181/F181 -> 0.63 | J181: 4 | K181: =D181*J181/10 -> 72 | L181: =D181*H181 -> 6300 | M181: =D181*J181*H181/10 -> 2520
A182: 凉鞋 | B182: 4169 | C182: 白色/夹脚/牛皮/凉拖 | D182: 95 | E182: 2010-6-24 16:34:30 | F182: 100 | G182: 54 | H182: 45 | I182: =G182/F182 -> 0.54 | J182: 4 | K182: =D182*J182/10 -> 38 | L182: =D182*H182 -> 4275 | M182: =D182*J182*H182/10 -> 1710
A183: 凉鞋 | B183: 4178 | C183: 迷彩/黑色/夹脚/凉拖 | D183: 88 | E183: 2010-6-23 17:30:34 | F183: 100 | G183: 30 | H183: 69 | I183: =G183/F183 -> 0.3 | J183: 4 | K183: =D183*J183/10 -> 35.2 | L183: =D183*H183 -> 6072 | M183: =D183*J183*H183/10 -> 2428.8
A184: 凉鞋 | B184: 4554 | C184: 牛皮/深棕色/夹脚/编带盘带/凉拖 | D184: 285 | E184: 2010-7-26 11:38:51 | F184: 200 | G184: 52 | H184: 137 | I184: =G184/F184 -> 0.26 | J184: 5 | K184: =D184*J184/10 -> 142.5 | L184: =D184*H184 -> 39045 | M184: =D184*J184*H184/10 -> 19522.5
A185: 凉鞋 | B185: 4067 | C185: 细纹小牛皮/灰色/全牛里/舒适橡筋底/凉鞋 | D185: 138 | E185: 2010-5-20 9:29:41 | F185: 300 | G185: 152 | H185: 138 | I185: =G185/F185 -> 0.50666666666666671 | J185: 5 | K185: =D185*J185/10 -> 69 | L185: =D185*H185 -> 19044 | M185: =D185*J185*H185/10 -> 9522
A186: 凉鞋 | B186: 4465 | C186: 牛皮/黑色/夹脚/粘扣/凉拖 | D186: 285 | E186: 2010-7-7 17:44:58 | F186: 298 | G186: 149 | H186: 145 | I186: =G186/F186 -> 0.5 | J186: 5 | K186: =D186*J186/10 -> 142.5 | L186: =D186*H186 -> 41325 | M186: =D186*J186*H186/10 -> 20662.5
A187: 凉鞋 | B187: 4466 | C187: 牛皮/深棕色/夹脚/凉拖 | D187: 285 | E187: 2010-7-7 16:19:45 | F187: 303 | G187: 146 | H187: 154 | I187: =G187/F187 -> 0.48184818481848185 | J187: 5 | K187: =D187*J187/10 -> 142.5 | L187: =D187*H187 -> 43890 | M187: =D187*J187*H187/10 -> 21945
A188: 凉鞋 | B188: 4464 | C188: 牛皮/黑色/夹脚/凉拖 | D188: 285 | E188: 2010-7-7 16:21:44 | F188: 298 | G188: 103 | H188: 192 | I188: =G188/F188 -> 0.34563758389261745 | J188: 5 | K188: =D188*J188/10 -> 142.5 | L188: =D188*H188 -> 54720 | M188: =D188*J188*H188/10 -> 27360
A189: 凉鞋 | B189: 4535 | C189: 牛皮/深棕色/夹脚/盘带/凉拖 | D189: 285 | E189: 2010-7-26 11:38:51 | F189: 200 | G189: 125 | H189: 72 | I189: =G189/F189 -> 0.625 | J189: 6 | K189: =D189*J189/10 -> 171 | L189: =D189*H189 -> 20520 | M189: =D189*J189*H189/10 -> 12312
A190: 凉鞋 | B190: 4066 | C190: 古典压纹小牛皮/黑色/全猪里/舒适PU底/凉鞋 | D190: 155 | E190: 2010-5-18 17:12:55 | F190: 299 | G190: 172 | H190: 113 | I190: =G190/F190 -> 0.57525083612040129 | J190: 6 | K190: =D190*J190/10 -> 93 | L190: =D190*H190 -> 17515 | M190: =D190*J190*H190/10 -> 10509
A191: 凉鞋 | B191: 4467 | C191: 牛皮/深棕色/夹脚/粘扣/凉拖 | D191: 285 | E191: 2010-7-8 15:22:30 | F191: 300 | G191: 160 | H191: 138 | I191: =G191/F191 -> 0.53333333333333333 | J191: 6 | K191: =D191*J191/10 -> 171 | L191: =D191*H191 -> 39330 | M191: =D191*J191*H191/10 -> 23598
L192: =SUM(L168:L191) -> 304841 | M192: =SUM(M168:M191) -> 156697.9 | N192: =M192/L192 -> 0.51403157711725123
A194: 品名 | B194: 款号 | C194: 名称 | D194: 价格 | E194: 日期 | F194: 入库 | G194: 销售 | H194: 库存 | I194: 产销比 | J194: 折扣 | K194: 折后价 | L194: 原总价 | M194: 折后总价
A195: 沙滩裤 | B195: 6064 | C195: 97%棉+3%弹力/蓝色/条纹面料/腰里宽橡筋/沙滩裤 | D195: 135 | E195: 2010-6-8 17:59:39 | F195: 622 | G195: 617 | H195: 1 | I195: =G195/F195 -> 0.99196141479099675 | J195: 3 | K195: =D195*J195/10 -> 40.5 | L195: =D195*H195 -> 135 | M195: =D195*J195*H195/10 -> 40.5
A196: 沙滩裤 | B196: 6063 | C196: 100%棉/紫色/格纹仿丝绸面料/腰里宽橡筋/沙滩裤 | D196: 135 | E196: 2010-6-24 16:59:25 | F196: 1362 | G196: 209 | H196: 1145 | I196: =G196/F196 -> 0.15345080763582966 | J196: 4 | K196: =D196*J196/10 -> 54 | L196: =D196*H196 -> 154575 | M196: =D196*J196*H196/10 -> 61830
A197: 沙滩裤 | B197: 6058 | C197: 100%棉/紫色/格纹仿丝绸面料/腰里宽橡筋/沙滩裤 | D197: 135 | E197: 2010-6-12 16:31:41 | F197: 1326 | G197: 400 | H197: 925 | I197: =G197/F197 -> 0.30165912518853694 | J197: 5 | K197: =D197*J197/10 -> 67.5 | L197: =D197*H197 -> 124875 | M197: =D197*J197*H197/10 -> 62437.5
A198: 沙滩裤 | B198: 6059 | C198: 98%棉+2%弹力/灰色/条纹磨毛整理面料/腰里宽橡筋/沙滩裤 | D198: 135 | E198: 2010-6-12 17:56:36 | F198: 1407 | G198: 621 | H198: 778 | I198: =G198/F198 -> 0.44136460554371004 | J198: 5 | K198: =D198*J198/10 -> 67.5 | L198: =D198*H198 -> 105030 | M198: =D198*J198*H198/10 -> 52515
A199: 沙滩裤 | B199: 6060 | C199: 100%棉/蓝色/条纹磨毛整理面料/腰里宽橡筋/沙滩裤 | D199: 135 | E199: 2010-6-9 10:08:28 | F199: 1348 | G199: 466 | H199: 868 | I199: =G199/F199 -> 0.3456973293768546 | J199: 5 | K199: =D199*J199/10 -> 67.5 | L199: =D199*H199 -> 117180 | M199: =D199*J199*H199/10 -> 58590
A200: 沙滩裤 | B200: 6061 | C200: 100%棉/黄色/格纹磨毛整理面料/腰里宽橡筋/沙滩裤 | D200: 135 | E200: 2010-6-24 16:59:25 | F200: 1265 | G200: 394 | H200: 865 | I200: =G200/F200 -> 0.31146245059288535 | J200: 5 | K200: =D200*J200/10 -> 67.5 | L200: =D200*H200 -> 116775 | M200: =D200*J200*H200/10 -> 58387.5
A201: 沙滩裤 | B201: 6062 | C201: 100%棉/蓝绿色/格纹仿丝绸面料/腰里宽橡筋/沙滩裤 | D201: 135 | E201: 2010-6-24 16:59:25 | F201: 1425 | G201: 548 | H201: 870 | I201: =G201/F201 -> 0.38456140350877194 | J201: 5 | K201: =D201*J201/10 -> 67.5 | L201: =D201*H201 -> 117450 | M201: =D201*J201*H201/10 -> 58725
L202: =SUM(L195:L201) -> 736020 | M202: =SUM(M195:M201) -> 352525.5 | N202: =M202/L202 -> 0.47896184886280263
A204: 品名 | B204: 款号 | C204: 名称 | D204: 价格 | E204: 日期 | F204: 入库 | G204: 销售 | H204: 库存 | I204: 产销比 | J204: 折扣 | K204: 折后价 | L204: 原总价 | M204: 折后总价
A205: 帽子 | B205: 4559 | C205: 100% PAPER/黑色/镂空/草编/男帽 | D205: 125 | E205: 2010-7-25 17:10:22 | F205: 150 | G205: 14 | H205: 133 | I205: =G205/F205 -> 9.3333333333333338E-2 | J205: 4 | K205: =D205*J205/10 -> 50 | L205: =D205*H205 -> 16625 | M205: =D205*J205*H205/10 -> 6650
A206: 帽子 | B206: 4560 | C206: 100% PAPER/草编/咖啡色/镂空/男帽 | D206: 125 | E206: 2010-7-25 17:10:22 | F206: 150 | G206: 18 | H206: 129 | I206: =G206/F206 -> 0.12 | J206: 4 | K206: =D206*J206/10 -> 50 | L206: =D206*H206 -> 16125 | M206: =D206*J206*H206/10 -> 6450
A207: 帽子 | B207: 4509 | C207: 100% STRAW（拉菲草）/白色/蓝色/草编/女式草帽 | D207: 125 | E207: 2010-7-6 17:55:35 | F207: 200 | G207: 53 | H207: 145 | I207: =G207/F207 -> 0.26500000000000001 | J207: 5 | K207: =D207*J207/10 -> 62.5 | L207: =D207*H207 -> 18125 | M207: =D207*J207*H207/10 -> 9062.5
A208: 帽子 | B208: 4557 | C208: 100% STRAW（拉菲草）/黑色/紫色/草编/女式/时尚草帽 | D208: 155 | E208: 2010-7-25 17:10:22 | F208: 150 | G208: 29 | H208: 121 | I208: =G208/F208 -> 0.19333333333333333 | J208: 5 | K208: =D208*J208/10 -> 77.5 | L208: =D208*H208 -> 18755 | M208: =D208*J208*H208/10 -> 9377.5
A209: 帽子 | B209: 4561 | C209: 草编/米色/镂空/男帽 | D209: 125 | E209: 2010-7-25 17:10:22 | F209: 150 | G209: 30 | H209: 117 | I209: =G209/F209 -> 0.2 | J209: 5 | K209: =D209*J209/10 -> 62.5 | L209: =D209*H209 -> 14625 | M209: =D209*J209*H209/10 -> 7312.5
A210: 帽子 | B210: 4562 | C210: 草编/稻草色/织带/男帽 | D210: 125 | E210: 2010-7-25 17:10:22 | F210: 150 | G210: 24 | H210: 123 | I210: =G210/F210 -> 0.16 | J210: 5 | K210: =D210*J210/10 -> 62.5 | L210: =D210*H210 -> 15375 | M210: =D210*J210*H210/10 -> 7687.5
A211: 帽子 | B211: 4563 | C211: 草编/黑色/织带装饰/时尚草帽 | D211: 155 | E211: 2010-7-25 17:10:22 | F211: 150 | G211: 17 | H211: 130 | I211: =G211/F211 -> 0.11333333333333333 | J211: 5 | K211: =D211*J211/10 -> 77.5 | L211: =D211*H211 -> 20150 | M211: =D211*J211*H211/10 -> 10075
A212: 帽子 | B212: 4564 | C212: 草编/米色/织带装饰/时尚草帽 | D212: 155 | E212: 2010-7-25 17:10:22 | F212: 150 | G212: 30 | H212: 117 | I212: =G212/F212 -> 0.2 | J212: 5 | K212: =D212*J212/10 -> 77.5 | L212: =D212*H212 -> 18135 | M212: =D212*J212*H212/10 -> 9067.5
A213: 帽子 | B213: 4510 | C213: 100% STRAW（拉菲草）/灰色/葡萄紫/草编/女式草帽 | D213: 125 | E213: 2010-7-6 17:55:35 | F213: 200 | G213: 71 | H213: 129 | I213: =G213/F213 -> 0.35499999999999998 | J213: 6 | K213: =D213*J213/10 -> 75 | L213: =D213*H213 -> 16125 | M213: =D213*J213*H213/10 -> 9675
A214: 帽子 | B214: 4558 | C214: 草编/米色/啡色/女式/时尚草帽 | D214: 155 | E214: 2010-7-25 17:10:22 | F214: 150 | G214: 59 | H214: 90 | I214: =G214/F214 -> 0.39333333333333331 | J214: 6 | K214: =D214*J214/10 -> 93 | L214: =D214*H214 -> 13950 | M214: =D214*J214*H214/10 -> 8370
K215: =SUM(K191:K214) -> 1291 | L215: =SUM(L205:L214) -> 167990 | M215: =SUM(M205:M214) -> 83727.5 | N215: =M215/L215 -> 0.49840764331210191